{
  "schema_version": 1,
  "task_id": "M2C1-boundary-preflight",
  "revision": 1,
  "status": "draft",
  "baseline_commit": null,
  "requirements_file": "requirements.md",
  "allowed_files_file": "allowed_files.json",
  "forbidden_files_file": "forbidden_files.json",
  "verification_file": "verification.json",
  "roles": {
    "planner": "A",
    "implementer": "B",
    "reviewer": "A",
    "fallback_repairer": "A",
    "final_verifier": "A"
  },
  "budgets": {
    "max_agent_calls": 10,
    "max_repair_rounds": 1,
    "max_takeovers": 1,
    "max_wall_seconds": 21600,
    "max_changed_files": 4,
    "max_diff_lines": 1800,
    "max_output_bytes": 1048576
  }
}
