{"allowed_files_file":"allowed_files.json","baseline_commit":"2805b1f03d95d0d8de5ab81ea8538822198c397c","budgets":{"max_agent_calls":10,"max_changed_files":4,"max_diff_lines":1800,"max_output_bytes":1048576,"max_repair_rounds":1,"max_takeovers":1,"max_wall_seconds":21600},"forbidden_files_file":"forbidden_files.json","requirements_file":"requirements.md","revision":1,"roles":{"fallback_repairer":"A","final_verifier":"A","implementer":"B","planner":"A","reviewer":"A"},"schema_version":1,"status":"frozen","task_id":"M2C1-boundary-preflight","verification_file":"verification.json"}