{
  "schema_version": 1,
  "task_id": "M0-process-adapter",
  "revision": 2,
  "status": "frozen",
  "baseline_commit": "c93c8c5054bd12246676337d37993c3c3adfbfb2",
  "requirements_file": "requirements.md",
  "allowed_files_file": "allowed_files.json",
  "forbidden_files_file": "forbidden_files.json",
  "verification_file": "verification.json",
  "roles": {
    "planner": "A",
    "implementer": "B",
    "reviewer": "A",
    "fallback_repairer": "A",
    "final_verifier": "A"
  },
  "budgets": {
    "max_agent_calls": 7,
    "max_repair_rounds": 1,
    "max_takeovers": 1,
    "max_wall_seconds": 3600,
    "max_changed_files": 12,
    "max_diff_lines": 1500,
    "max_output_bytes": 1048576
  }
}
