{
  "schema_version": 1,
  "task_id": "M0R-review2-remediation",
  "revision": 1,
  "status": "frozen",
  "baseline_commit": "fc479e760cbcd1e5259e2d62aeddaa6033d2c915",
  "requirements_file": "requirements.md",
  "allowed_files_file": "allowed_files.json",
  "forbidden_files_file": "forbidden_files.json",
  "verification_file": "verification.json",
  "roles": {
    "planner": "A",
    "implementer": "B",
    "reviewer": "A",
    "fallback_repairer": "A",
    "final_verifier": "A"
  },
  "budgets": {
    "max_agent_calls": 7,
    "max_repair_rounds": 1,
    "max_takeovers": 1,
    "max_wall_seconds": 5400,
    "max_changed_files": 10,
    "max_diff_lines": 1800,
    "max_output_bytes": 1048576
  }
}
