{"allowed_files_file":"allowed_files.json","baseline_commit":"85fde6074d45ea0137a2dc55aae3362befa91639","budgets":{"max_agent_calls":10,"max_changed_files":4,"max_diff_lines":2200,"max_output_bytes":1048576,"max_repair_rounds":1,"max_takeovers":1,"max_wall_seconds":21600},"forbidden_files_file":"forbidden_files.json","requirements_file":"requirements.md","revision":1,"roles":{"fallback_repairer":"A","final_verifier":"A","implementer":"B","planner":"A","reviewer":"A"},"schema_version":1,"status":"frozen","task_id":"M2B-hermes-adapter-fixtures","verification_file":"verification.json"}