{"allowed_files_file":"allowed_files.json","baseline_commit":"51d497cae7f20872e5a5f9c8825fd0f83323a92f","budgets":{"max_agent_calls":10,"max_changed_files":80,"max_diff_lines":6000,"max_output_bytes":1048576,"max_repair_rounds":1,"max_takeovers":1,"max_wall_seconds":28800},"forbidden_files_file":"forbidden_files.json","requirements_file":"requirements.md","revision":1,"roles":{"fallback_repairer":"A","final_verifier":"A","implementer":"B","planner":"A","reviewer":"A"},"schema_version":1,"status":"frozen","task_id":"M2C2A-seatbelt-synthetic","verification_file":"verification.json"}