{"allowed_files_file":"allowed_files.json","baseline_commit":"35f948fd40a6bf3e63982fd884422206cbffd28a","budgets":{"max_agent_calls":7,"max_changed_files":2,"max_diff_lines":2000,"max_output_bytes":1048576,"max_repair_rounds":1,"max_takeovers":1,"max_wall_seconds":14400},"forbidden_files_file":"forbidden_files.json","requirements_file":"requirements.md","revision":1,"roles":{"fallback_repairer":"A","final_verifier":"A","implementer":"B","planner":"A","reviewer":"A"},"schema_version":1,"status":"frozen","task_id":"M2A-hermes-capabilities","verification_file":"verification.json"}